{
  "$ref": "#/definitions/products",
  "definitions": {
    "products": {
      "type": "object",
      "properties": {
        "id": {
          "type": "number"
        },
        "name": {
          "type": "string"
        },
        "price": {
          "type": "number"
        },
        "category": {
          "type": "string"
        },
        "collection": {
          "type": "string"
        },
        "image": {
          "type": "string"
        },
        "description": {
          "type": "string"
        },
        "sizes": {
          "type": "array",
          "items": {
            "type": "string"
          }
        },
        "composition": {
          "type": "string"
        },
        "characteristics": {
          "type": "array",
          "items": {
            "type": "object",
            "properties": {
              "name": {
                "type": "string"
              },
              "value": {
                "type": "string"
              }
            },
            "required": [
              "name",
              "value"
            ],
            "additionalProperties": false
          }
        },
        "gallery": {
          "type": "array",
          "items": {
            "type": "string"
          }
        },
        "isAvailable": {
          "type": "boolean"
        },
        "isPopular": {
          "type": "boolean"
        },
        "$schema": {
          "type": "string"
        }
      },
      "required": [
        "id",
        "name",
        "price",
        "category",
        "image",
        "description",
        "sizes",
        "characteristics",
        "gallery",
        "isAvailable"
      ],
      "additionalProperties": false
    }
  },
  "$schema": "http://json-schema.org/draft-07/schema#"
}